>>obey TEST003(test);
>>
>>sh sqlci -i "TEST003(ddl)"&;
>>select sleep(5) from dual;

(EXPR)     
-----------

          1

--- 1 row(s) selected.
>>obey TEST003(dml);
>>set schema ccsch003;

--- SQL operation complete.
>>
>>CQD TRAF_LOCK_DDL 'OFF';

--- SQL operation complete.
>>
>>prepare xx from insert into t_ddl_xx select a from t_ddl_xx_seq;

--- SQL command prepared.
>>begin work;

--- SQL operation complete.
>>update t_ddl_xx_seq set a = a+1;

--- 1 row(s) updated.
>>select a from t_ddl_xx_seq;

A          
-----------

          1

--- 1 row(s) selected.
>>execute xx;

--- 1 row(s) inserted.
>>select a from t_ddl_xx;

A          
-----------

          1

--- 1 row(s) selected.
>>commit;

--- SQL operation complete.
>>select sleep(1) from dual;

(EXPR)     
-----------

          1

--- 1 row(s) selected.
>>begin work;

--- SQL operation complete.
>>update t_ddl_xx_seq set a = a+1;

--- 1 row(s) updated.
>>select a from t_ddl_xx_seq;

A          
-----------

          2

--- 1 row(s) selected.
>>execute xx;

--- 1 row(s) inserted.
>>select a from t_ddl_xx;

A          
-----------

          1
          2

--- 2 row(s) selected.
>>commit;

--- SQL operation complete.
>>select sleep(1) from dual;

(EXPR)     
-----------

          1

--- 1 row(s) selected.
>>begin work;

--- SQL operation complete.
>>update t_ddl_xx_seq set a = a+1;

--- 1 row(s) updated.
>>select a from t_ddl_xx_seq;

A          
-----------

          3

--- 1 row(s) selected.
>>execute xx;

--- 1 row(s) inserted.
>>select a from t_ddl_xx;

A          
-----------

          1
          2
          3

--- 3 row(s) selected.
>>commit;

--- SQL operation complete.
>>select sleep(1) from dual;

(EXPR)     
-----------

          1

--- 1 row(s) selected.
>>begin work;

--- SQL operation complete.
>>update t_ddl_xx_seq set a = a+1;

--- 1 row(s) updated.
>>select a from t_ddl_xx_seq;

A          
-----------

          4

--- 1 row(s) selected.
>>execute xx;

--- 1 row(s) inserted.
>>select a from t_ddl_xx;

A          
-----------

          1
          2
          3
          4

--- 4 row(s) selected.
>>commit;

--- SQL operation complete.
>>select sleep(1) from dual;

(EXPR)     
-----------

          1

--- 1 row(s) selected.
>>begin work;

--- SQL operation complete.
>>update t_ddl_xx_seq set a = a+1;

--- 1 row(s) updated.
>>select a from t_ddl_xx_seq;

A          
-----------

          5

--- 1 row(s) selected.
>>execute xx;

--- 1 row(s) inserted.
>>select a from t_ddl_xx;

A          
-----------

          1
          2
          3
          4
          5

--- 5 row(s) selected.
>>commit;

--- SQL operation complete.
>>select sleep(1) from dual;

(EXPR)     
-----------

          1

--- 1 row(s) selected.
>>begin work;

--- SQL operation complete.
>>update t_ddl_xx_seq set a = a+1;

--- 1 row(s) updated.
>>select a from t_ddl_xx_seq;

A          
-----------

          6

--- 1 row(s) selected.
>>execute xx;

--- 1 row(s) inserted.
>>select a from t_ddl_xx;

A          
-----------

          1
          2
          3
          4
          5
          6

--- 6 row(s) selected.
>>commit;

--- SQL operation complete.
>>begin work;

--- SQL operation complete.
>>update t_ddl_xx_seq set a = a+1;

--- 1 row(s) updated.
>>select a from t_ddl_xx_seq;

A          
-----------

          7

--- 1 row(s) selected.
>>execute xx;

--- 1 row(s) inserted.
>>select a from t_ddl_xx;

A          
-----------

          1
          2
          3
          4
          5
          6
          7

--- 7 row(s) selected.
>>commit;

--- SQL operation complete.
>>begin work;

--- SQL operation complete.
>>update t_ddl_xx_seq set a = a+1;

--- 1 row(s) updated.
>>select a from t_ddl_xx_seq;

A          
-----------

          8

--- 1 row(s) selected.
>>execute xx;

--- 1 row(s) inserted.
>>select a from t_ddl_xx;

A          
-----------

          1
          2
          3
          4
          5
          6
          7
          8

--- 8 row(s) selected.
>>commit;

--- SQL operation complete.
>>begin work;

--- SQL operation complete.
>>update t_ddl_xx_seq set a = a+1;

--- 1 row(s) updated.
>>select a from t_ddl_xx_seq;

A          
-----------

          9

--- 1 row(s) selected.
>>execute xx;

--- 1 row(s) inserted.
>>select a from t_ddl_xx;

A          
-----------

          1
          2
          3
          4
          5
          6
          7
          8
          9

--- 9 row(s) selected.
>>commit;

--- SQL operation complete.
>>begin work;

--- SQL operation complete.
>>update t_ddl_xx_seq set a = a+1;

--- 1 row(s) updated.
>>select a from t_ddl_xx_seq;

A          
-----------

         10

--- 1 row(s) selected.
>>execute xx;

--- 1 row(s) inserted.
>>select a from t_ddl_xx;

A          
-----------

          1
          2
          3
          4
          5
          6
          7
          8
          9
         10

--- 10 row(s) selected.
>>commit;

--- SQL operation complete.
>>
>>log;
